{"completion_schema_version":1,"manifest_digest":"1ec7ebe4586d2a3cd4894d330170e6721ba83f6b95cc160e969cfdf23d3cc899","results_digest":"7c056f60e7a13c93bfa009646bc219f37b4a7b7eef5d90963e2805a16506027f","run_id":"16000000000000000000000000000002","source_integrity":{"end_fingerprint":"bbbbbbbbbbbbbbbbbbbbbbbbbbbbbbbbbbbbbbbbbbbbbbbbbbbbbbbbbbbbbbbb","end_source":{"dirty_state":"CLEAN","git_commit":"aaaaaaaaaaaaaaaaaaaaaaaaaaaaaaaaaaaaaaaa","source_fingerprint":"bbbbbbbbbbbbbbbbbbbbbbbbbbbbbbbbbbbbbbbbbbbbbbbbbbbbbbbbbbbbbbbb"},"start_fingerprint":"bbbbbbbbbbbbbbbbbbbbbbbbbbbbbbbbbbbbbbbbbbbbbbbbbbbbbbbbbbbbbbbb","start_source":{"dirty_state":"CLEAN","git_commit":"aaaaaaaaaaaaaaaaaaaaaaaaaaaaaaaaaaaaaaaa","source_fingerprint":"bbbbbbbbbbbbbbbbbbbbbbbbbbbbbbbbbbbbbbbbbbbbbbbbbbbbbbbbbbbbbbbb"},"state":"MATCH"},"state":"COMPLETED","timestamp":"2026-09-30T01:11:01.973654+00:00"}